{
  "$schema": "https://json-schema.org/draft/2020-12/schema",
  "$id": "https://proteus.example/schemas/profile-config.schema.json",
  "title": "Proteus Profile Config",
  "description": "The signed, versioned configuration that the fingerprint engine produces and the browser engine consumes at launch. This is the central contract of the system. Derived fields (userAgent, clientHints, locale) MUST be computed by the fingerprint engine from persona+engine+proxy, never hand-authored, to guarantee coherence (threat vector V1). Secrets (e.g. proxy credentials) MUST NOT appear here. See docs/04-architecture.md §6 and docs/adr/0006.",
  "type": "object",
  "required": [
    "schemaVersion",
    "profileId",
    "seed",
    "engine",
    "persona",
    "navigator",
    "clientHints",
    "screen",
    "gpu",
    "fonts",
    "media",
    "locale",
    "performance",
    "noise",
    "network",
    "rarity",
    "provenance",
    "signature"
  ],
  "additionalProperties": false,
  "properties": {
    "schemaVersion": {
      "const": "1.0.0",
      "description": "SemVer of this exact strict schema. Consumers reject unsupported versions and unknown fields; a compatible schema revision must still be explicitly supported rather than silently ignored."
    },
    "profileId": {
      "type": "string",
      "format": "uuid",
      "pattern": "^[0-9A-Fa-f]{8}-[0-9A-Fa-f]{4}-[0-9A-Fa-f]{4}-[0-9A-Fa-f]{4}-[0-9A-Fa-f]{12}$",
      "description": "Stable identifier of the profile this config realizes."
    },
    "seed": {
      "type": "string",
      "contentEncoding": "base64",
      "pattern": "^[A-Za-z0-9+/]{43}=$",
      "description": "32-byte base64 root seed. Deterministically derives all per-profile noise and sampler streams (HMAC(seed, label)). Exact reproduction also requires profileId, persona including the region mapping recovered from timezone, the explicit engine target, schema/rules/generator versions, and the exact dataset bytes identified by datasetSha256. Per-profile independent seeds avoid a shared noise watermark."
    },
    "engine": {
      "type": "object",
      "required": ["family", "brand", "majorVersion", "fullVersion"],
      "additionalProperties": false,
      "description": "The engine identity. A brand is only valid within its real family — no cross-family impersonation (ADR 0002).",
      "properties": {
        "family": {
          "type": "string",
          "enum": ["chromium", "firefox"],
          "description": "Engine family. Never crossed: chromium presents only as chromium-family brands; firefox only as Firefox."
        },
        "brand": {
          "type": "string",
          "enum": ["Chrome", "Edge", "Brave", "Opera", "Firefox"],
          "description": "Presented brand. MUST be valid for family (Chrome/Edge/Brave/Opera => chromium; Firefox => firefox)."
        },
        "majorVersion": {
          "type": "integer",
          "minimum": 1,
          "maximum": 4294967295,
          "description": "Major version. Should fall within the currently-live population window for the brand (rule R-VERSION-LIVE, else V2 rarity)."
        },
        "fullVersion": {
          "type": "string",
          "pattern": "^\\d+(?:\\.\\d+){1,3}$",
          "description": "Full version string; must be internally consistent with clientHints.fullVersionList."
        }
      },
      "allOf": [
        {
          "if": { "properties": { "family": { "const": "firefox" } } },
          "then": { "properties": { "brand": { "const": "Firefox" } } }
        },
        {
          "if": { "properties": { "family": { "const": "chromium" } } },
          "then": { "properties": { "brand": { "enum": ["Chrome", "Edge", "Brave", "Opera"] } } }
        }
      ]
    },
    "persona": {
      "type": "object",
      "required": ["os", "device"],
      "additionalProperties": false,
      "description": "The 'one plausible real device' from which fields are derived (tdd/02 §3).",
      "properties": {
        "os": {
          "type": "object",
          "required": ["name", "version", "arch"],
          "additionalProperties": false,
          "properties": {
            "name": { "type": "string", "enum": ["Windows", "macOS", "Linux", "ChromeOS", "Android", "iOS"] },
            "version": { "type": "string" },
            "arch": { "type": "string", "enum": ["x86_64", "arm64", "x86"] }
          }
        },
        "device": {
          "type": "object",
          "required": ["class", "model"],
          "additionalProperties": false,
          "properties": {
            "class": { "type": "string", "enum": ["desktop", "laptop", "tablet", "phone"] },
            "model": { "type": ["string", "null"] }
          }
        }
      }
    },
    "navigator": {
      "type": "object",
      "required": ["userAgent", "platform", "languages", "hardwareConcurrency", "deviceMemory", "vendor", "oscpu"],
      "additionalProperties": false,
      "properties": {
        "userAgent": { "type": "string", "description": "DERIVED from engine+persona. Never hand-authored." },
        "platform": { "type": "string", "description": "e.g. Win32, MacIntel, Linux x86_64. Must be possible for persona.os and consistent with gpu (rule R-PLATFORM-GPU)." },
        "languages": { "type": "array", "items": { "type": "string" }, "minItems": 1, "description": "languages[0] head must match locale.acceptLanguage head (R-LANG)." },
        "hardwareConcurrency": { "type": "integer", "minimum": 1, "maximum": 4294967295, "description": "Plausible pair with deviceMemory for device.class (R-HW-PAIR)." },
        "deviceMemory": { "type": "number", "minimum": 0.25, "maximum": 1024, "description": "GiB; plausible pair with hardwareConcurrency." },
        "vendor": { "type": "string", "description": "e.g. 'Google Inc.' for Chromium; '' for Firefox. Derived from engine." },
        "oscpu": { "type": ["string", "null"], "description": "Firefox-family where applicable; derived from persona.os." }
      }
    },
    "clientHints": {
      "type": ["object", "null"],
      "description": "DERIVED from engine+persona. Chromium requires this object; Firefox requires null. MUST agree with navigator.userAgent (rule R-UA-CH). Applies to both JS navigator.userAgentData and outgoing HTTP request headers.",
      "required": ["brands", "fullVersionList", "platform", "platformVersion", "architecture", "bitness", "model", "mobile"],
      "additionalProperties": false,
      "properties": {
        "brands": { "type": "array", "items": { "$ref": "#/$defs/brandVersion" }, "minItems": 1, "description": "Sec-CH-UA brand list." },
        "fullVersionList": { "type": "array", "items": { "$ref": "#/$defs/brandVersion" }, "minItems": 1, "description": "Must contain the exact engine.fullVersion for the presented brand." },
        "platform": { "type": "string", "description": "Sec-CH-UA-Platform; matches persona.os." },
        "platformVersion": { "type": "string" },
        "architecture": { "type": "string" },
        "bitness": { "type": "string" },
        "model": { "type": "string" },
        "mobile": { "type": "boolean", "description": "Must match persona.device.class." }
      }
    },
    "screen": {
      "type": "object",
      "required": ["width", "height", "availWidth", "availHeight", "colorDepth", "devicePixelRatio"],
      "additionalProperties": false,
      "description": "(width,height,devicePixelRatio,colorDepth) must be a really-shipped tuple for (os,class) (rule R-SCREEN-REAL). avail* leave OS-appropriate chrome room. The actual opened window must be consistent with reported inner sizes (else a headless-style V5 tell).",
      "properties": {
        "width": { "type": "integer", "minimum": 1, "maximum": 4294967295 },
        "height": { "type": "integer", "minimum": 1, "maximum": 4294967295 },
        "availWidth": { "type": "integer", "minimum": 1, "maximum": 4294967295 },
        "availHeight": { "type": "integer", "minimum": 1, "maximum": 4294967295 },
        "colorDepth": { "type": "integer", "enum": [24, 30, 48] },
        "devicePixelRatio": { "type": "number", "minimum": 0.5, "maximum": 16 }
      }
    },
    "gpu": {
      "type": "object",
      "required": ["webglVendor", "webglRenderer", "webglExtensions", "webgpuAdapter"],
      "additionalProperties": false,
      "description": "GPU strings from the dataset, matched to persona. WebGL family and WebGPU adapter family MUST agree (R-WEBGL-WEBGPU) and MUST be possible on persona.os (R-PLATFORM-GPU: no Apple renderer under Win32).",
      "properties": {
        "webglVendor": { "type": "string" },
        "webglRenderer": { "type": "string" },
        "webglExtensions": { "type": "array", "items": { "type": "string" }, "description": "Consistent with the GPU family." },
        "webgpuAdapter": {
          "type": ["object", "null"],
          "description": "Adapter info/limits, consistent with webglRenderer, or null where the persona would not expose WebGPU (but consistently).",
          "required": ["family", "vendor", "architecture", "device", "description"],
          "additionalProperties": false,
          "properties": {
            "family": { "type": "string" },
            "vendor": { "type": "string" },
            "architecture": { "type": "string" },
            "device": { "type": "string" },
            "description": { "type": "string" }
          }
        }
      }
    },
    "fonts": {
      "type": "object",
      "required": ["set", "policy"],
      "additionalProperties": false,
      "description": "Presented font set for persona.os. Must be superset(core) ⊆ set ⊆ superset(os.version) (rule R-FONT-OS). Enforced natively so host fonts never leak.",
      "properties": {
        "set": { "type": "array", "items": { "type": "string" }, "minItems": 1 },
        "policy": { "type": "string", "enum": ["os-superset-restricted"] }
      }
    },
    "media": {
      "type": "object",
      "required": ["profileId", "devices", "speechVoices"],
      "additionalProperties": false,
      "description": "OS-appropriate device and voice sets (rule R-MEDIA-OS).",
      "properties": {
        "profileId": { "type": "string", "description": "Versioned dataset media-profile identifier." },
        "devices": {
          "type": "array",
          "minItems": 1,
          "items": { "$ref": "#/$defs/mediaDevice" },
          "description": "enumerateDevices shape; stable seed-derived deviceIds."
        },
        "speechVoices": {
          "type": "array",
          "minItems": 1,
          "items": { "$ref": "#/$defs/speechVoice" },
          "description": "OS-appropriate TTS voices."
        }
      }
    },
    "locale": {
      "type": "object",
      "required": ["timezone", "acceptLanguage", "intlLocale"],
      "additionalProperties": false,
      "description": "DERIVED from region, defaulted from proxy geo. timezone MUST match the proxy IP geolocation when a proxy is attached (rule R-TZ-GEO); Intl timezone, Date offset behavior, and this value MUST all agree.",
      "properties": {
        "timezone": { "type": "string", "description": "IANA tz, e.g. America/New_York." },
        "acceptLanguage": { "type": "string", "description": "e.g. 'en-US,en;q=0.9'. Head matches navigator.languages[0]." },
        "intlLocale": { "type": "string" }
      }
    },
    "performance": {
      "type": "object",
      "required": ["timerPrecisionMicros"],
      "additionalProperties": false,
      "description": "Timer precision policy derived from the engine family/version (rule R-PERF-PRECISION).",
      "properties": {
        "timerPrecisionMicros": { "type": "integer", "minimum": 1, "maximum": 4294967295 }
      }
    },
    "noise": {
      "type": "object",
      "required": ["canvas", "webgl", "audio", "clientRects"],
      "additionalProperties": false,
      "description": "Deterministic, per-profile, bounded perturbation seeded from `seed`. Stable across sessions for one profile (site sees a consistent ID like a real device), different across profiles, amplitude within natural hardware/driver variation so it never pushes the coarse observable into the rare tail (co-designed with rarity scoring).",
      "properties": {
        "canvas": { "$ref": "#/$defs/noiseSpec" },
        "webgl": { "$ref": "#/$defs/noiseSpec" },
        "audio": { "$ref": "#/$defs/noiseSpec" },
        "clientRects": {
          "type": "object",
          "required": ["mode"],
          "additionalProperties": false,
          "properties": { "mode": { "type": "string", "enum": ["off", "subpixel"] } }
        }
      }
    },
    "network": {
      "type": "object",
      "required": ["quicPolicy", "webrtcPolicy"],
      "additionalProperties": false,
      "description": "Hints shared with the sidecar so engine and network agree (not sidecar credentials — those come from the proxy library).",
      "properties": {
        "quicPolicy": { "type": "string", "enum": ["match-brand", "disable-coherently"], "description": "H3 behavior consistent with the claimed brand/version (tdd/03 §7)." },
        "webrtcPolicy": { "type": "string", "enum": ["proxy-only", "disabled"], "description": "WebRTC egress constraint; proxy-only avoids real-IP leak while looking normal (tdd/03 §8)." }
      }
    },
    "rarity": {
      "type": "object",
      "required": ["score", "verdict", "reasons"],
      "additionalProperties": false,
      "description": "Informational M1A seed heuristic surfaced to callers. It is not calibrated population probability; full distribution-backed rarity arrives in M4.",
      "properties": {
        "score": {
          "type": "number",
          "minimum": 0,
          "maximum": 1,
          "anyOf": [
            { "const": 0 },
            { "minimum": 0.000001 }
          ]
        },
        "verdict": { "type": "string", "enum": ["blends-in", "borderline", "too-rare"] },
        "reasons": { "type": "array", "items": { "type": "string" } }
      }
    },
    "provenance": {
      "type": "object",
      "required": ["datasetVersion", "datasetSha256", "engineVersion", "rulesVersion", "generatorVersion"],
      "additionalProperties": false,
      "description": "Version stamps and exact dataset-byte digest used for audit and replay. Reproduction additionally requires profileId, seed, the full persona and recovered region, the explicit engine target, and this schema version.",
      "properties": {
        "datasetVersion": { "type": "string" },
        "datasetSha256": {
          "type": "string",
          "pattern": "^[0-9a-f]{64}$",
          "description": "SHA-256 of the exact loaded dataset bytes, binding the version label to content."
        },
        "engineVersion": { "type": "string" },
        "rulesVersion": { "type": "string" },
        "generatorVersion": { "type": "string" }
      }
    },
    "signature": {
      "type": "object",
      "required": ["algorithm", "canonicalization", "domain", "keyId", "value"],
      "additionalProperties": false,
      "description": "Manager signature over domain-prefix || UTF-8(keyId) || NUL || canonical bytes of all top-level fields except signature. Binding keyId prevents an unsigned trust-store alias substitution. The canonicalization identifier is RFC8785, but the current implementation deliberately accepts only the strict Profile Config value domain and is cross-checked by fixed Rust/Node vectors; it is not exposed as a generic arbitrary-JSON canonicalizer. The current library resolves keyId through a strict trust-store abstraction; the target engine will provision that store as an installation-scoped protected trust anchor and FAIL CLOSED on any error.",
      "properties": {
        "algorithm": { "const": "Ed25519" },
        "canonicalization": { "const": "RFC8785" },
        "domain": { "const": "proteus-profile-config/v1" },
        "keyId": {
          "type": "string",
          "minLength": 1,
          "maxLength": 96,
          "pattern": "^[A-Za-z0-9._:-]+$"
        },
        "value": {
          "type": "string",
          "contentEncoding": "base64",
          "pattern": "^[A-Za-z0-9+/]{86}==$",
          "description": "Standard-base64 encoding of the 64-byte Ed25519 signature."
        }
      }
    }
  },
  "allOf": [
    {
      "if": {
        "type": "object",
        "properties": {
          "engine": {
            "type": "object",
            "properties": { "family": { "const": "chromium" } },
            "required": ["family"]
          }
        },
        "required": ["engine"]
      },
      "then": {
        "properties": { "clientHints": { "type": "object" } }
      }
    },
    {
      "if": {
        "type": "object",
        "properties": {
          "engine": {
            "type": "object",
            "properties": { "family": { "const": "firefox" } },
            "required": ["family"]
          }
        },
        "required": ["engine"]
      },
      "then": {
        "properties": { "clientHints": { "type": "null" } }
      }
    }
  ],
  "$defs": {
    "brandVersion": {
      "type": "object",
      "required": ["brand", "version"],
      "additionalProperties": false,
      "properties": {
        "brand": { "type": "string" },
        "version": { "type": "string" }
      }
    },
    "mediaDevice": {
      "type": "object",
      "required": ["kind", "label", "deviceId", "groupId"],
      "additionalProperties": false,
      "properties": {
        "kind": { "type": "string", "enum": ["audioinput", "audiooutput", "videoinput"] },
        "label": { "type": "string" },
        "deviceId": { "type": "string", "minLength": 1 },
        "groupId": { "type": "string", "minLength": 1 }
      }
    },
    "speechVoice": {
      "type": "object",
      "required": ["name", "lang", "localService", "default"],
      "additionalProperties": false,
      "properties": {
        "name": { "type": "string" },
        "lang": { "type": "string" },
        "localService": { "type": "boolean" },
        "default": { "type": "boolean" }
      }
    },
    "noiseSpec": {
      "type": "object",
      "required": ["mode", "amplitude"],
      "additionalProperties": false,
      "properties": {
        "mode": { "type": "string", "enum": ["off", "perturb"] },
        "amplitude": { "type": "string", "enum": ["hw-natural"], "description": "Bounded to natural hardware/driver variation; larger amplitudes are rejected to avoid becoming a unique ID (V2)." }
      }
    }
  }
}
